{
  "paper_id": "W1983320747",
  "annotations": [
    {
      "keyword_id": "semi-supervised-learning",
      "exact_quote": "This book addresses some theoretical aspects of semisupervised learning (SSL).",
      "evidence_field": "abstract",
      "reason_zh": "摘要明确以半监督学习（SSL）为书籍主题，并讨论其理论与方法，满足该学习设定。"
    }
  ],
  "abstentions": [],
  "input_issues": []
}
