{
  "paper_id": "W2072187267",
  "annotations": [
    {
      "keyword_id": "dimensionality-reduction",
      "exact_quote": "Dimension reduction (DR) is a necessary and helpful preprocessing for hyperspectral image (HSI) classification.",
      "evidence_field": "abstract",
      "reason_zh": "摘要明确将降维作为任务，并提出SSRLDE学习判别投影以实现高光谱数据降维。"
    },
    {
      "keyword_id": "hyperspectral-images",
      "exact_quote": "Dimension reduction (DR) is a necessary and helpful preprocessing for hyperspectral image (HSI) classification.",
      "evidence_field": "abstract",
      "reason_zh": "摘要和标题均以高光谱图像为处理对象，面向高光谱图像分类。"
    },
    {
      "keyword_id": "graph-manifold-regularization",
      "exact_quote": "Then, the local similarity information is described by integrating a spectral-domain regularized local preserving scatter matrix and a spatial-domain local pixel neighborhood preserving scatter matrix.",
      "evidence_field": "abstract",
      "reason_zh": "方法利用谱域局部保持散度矩阵和空域局部像素邻域保持散度矩阵，以局部相似性约束投影学习，属于邻域/流形正则化。"
    },
    {
      "keyword_id": "multi-view-learning",
      "exact_quote": "Then, the local similarity information is described by integrating a spectral-domain regularized local preserving scatter matrix and a spatial-domain local pixel neighborhood preserving scatter matrix.",
      "evidence_field": "abstract",
      "reason_zh": "摘要明确联合谱域和空域两类互补表示/邻域信息构建散度矩阵，显式利用空间与光谱视图关系。"
    }
  ],
  "abstentions": [
    {
      "keyword_id": "graph-structure-learning",
      "reason_zh": "摘要仅说明局部相似性与邻域保持散度矩阵，未明确学习或修正样本间边/亲和矩阵，不足以判定为图结构学习。"
    }
  ],
  "input_issues": []
}
