{
  "paper_id": "W4413074401",
  "annotations": [
    {
      "keyword_id": "nonnegative-matrix-factorization",
      "exact_quote": "orthogonal symmetric nonnegative matrix factorization (SNMF)",
      "evidence_field": "abstract",
      "reason_zh": "论文提出正交对称非负矩阵分解（SNMF）并用其获取各网络潜在表示，属于非负矩阵分解方法。"
    },
    {
      "keyword_id": "low-rank-modeling",
      "exact_quote": "a weighted tensor nuclear norm is utilized to constrain the tensor to make it low-rank",
      "evidence_field": "abstract",
      "reason_zh": "摘要明确用加权张量核范数约束张量使其低秩，是对低秩张量结构的显式建模。"
    },
    {
      "keyword_id": "multi-view-learning",
      "exact_quote": "existing community detection methods rarely consider the relationships between multilayer networks",
      "evidence_field": "abstract",
      "reason_zh": "多层网络可视为同一节点集合的多层/多视图观测，摘要显式关注层间关系并联合各层表示用于社区检测。"
    },
    {
      "keyword_id": "subspace-clustering",
      "exact_quote": "a clean self-representation tensor is got based on subspace learning",
      "evidence_field": "abstract",
      "reason_zh": "摘要基于子空间学习获得干净自表达张量，自表达关系用于多层网络社区划分，符合子空间聚类机制。"
    },
    {
      "keyword_id": "graph-structure-learning",
      "exact_quote": "a clean self-representation tensor is got based on subspace learning",
      "evidence_field": "abstract",
      "reason_zh": "摘要学习自表达张量作为样本/网络间关系结构，并对其施加低秩约束，属于学习亲和关系结构。"
    }
  ],
  "abstentions": [],
  "input_issues": []
}
