{
  "paper_id": "W2166049352",
  "annotations": [
    {
      "keyword_id": "bayesian-inference",
      "exact_quote": "The parameters of the model are learnt incrementally in a Bayesian manner.",
      "evidence_field": "abstract",
      "reason_zh": "模型参数以贝叶斯方式增量学习，使用先验信息进行概率建模，符合贝叶斯推断。"
    },
    {
      "keyword_id": "weakly-supervised-learning",
      "exact_quote": "We present an method for learning object categories from just a few training images.",
      "evidence_field": "abstract",
      "reason_zh": "核心设定是仅用少量训练图像学习物体类别，以有限标注作为实质监督条件。"
    }
  ],
  "abstentions": [
    {
      "keyword_id": "domain-adaptation",
      "reason_zh": "提到从先前学习的无关类别获取先验信息，但未明确源域与目标域分布差异及跨域适配过程，无法确认域适应。"
    }
  ],
  "input_issues": []
}
