{
  "paper_id": "W4404519684",
  "annotations": [
    {
      "keyword_id": "multi-view-learning",
      "exact_quote": "the multi-view features contain information of consistency and complementarity",
      "evidence_field": "abstract",
      "reason_zh": "摘要明确同一对象具有一致性/互补性的多视图特征并对其进行融合，满足多视图学习设定。"
    },
    {
      "keyword_id": "low-rank-modeling",
      "exact_quote": "we present a multi-view fusion optimization method via low-rank tensor decomposition",
      "evidence_field": "abstract",
      "reason_zh": "方法明确以低秩张量分解建模多视图特征，属于显式低秩分解/约束。"
    },
    {
      "keyword_id": "dimensionality-reduction",
      "exact_quote": "generate optimal low-dimensional embedding features",
      "evidence_field": "abstract",
      "reason_zh": "最终生成最优低维嵌入特征，体现显式低维嵌入与维度压缩目标。"
    }
  ],
  "abstentions": [
    {
      "keyword_id": "graph-manifold-regularization",
      "reason_zh": "摘要提到用KNN构造Laplacian矩阵并生成低维特征，但未说明将其作为图/流形正则项约束学习结果，缺几何一致性约束证据。"
    }
  ],
  "input_issues": []
}
