{
  "paper_id": "W2131628350",
  "annotations": [
    {
      "keyword_id": "low-rank-modeling",
      "exact_quote": "Exact Recovery of Corrupted Low-Rank Matrices via Convex Optimization",
      "evidence_field": "title",
      "reason_zh": "标题明确以低秩矩阵为建模对象，研究受损低秩矩阵的精确恢复，属于显式利用低秩结构。"
    },
    {
      "keyword_id": "data-imputation-recovery",
      "exact_quote": "Exact Recovery of Corrupted Low-Rank Matrices",
      "evidence_field": "title",
      "reason_zh": "标题表明任务是从受污染观测中恢复原始低秩矩阵，输出为待恢复数据，符合数据补全与恢复。"
    }
  ],
  "abstentions": [
    {
      "keyword_id": "sparse-representation",
      "reason_zh": "标题只提受损低秩矩阵，未说明用稀疏字典或少量原子/特征表示样本，稀疏成分证据不足。"
    },
    {
      "keyword_id": "dimensionality-reduction",
      "reason_zh": "PCA名称可能提示降维，但标题强调受损低秩矩阵的精确恢复，未说明显式低维映射或维度压缩目标。"
    }
  ],
  "input_issues": [
    "abstract字段为DSpace存储库元数据，仅包含文件校验和日期信息，未提供论文研究摘要，与标题明显不一致。"
  ]
}
