{
  "paper_id": "W2938059573",
  "annotations": [
    {
      "keyword_id": "subspace-clustering",
      "exact_quote": "We learn the subspace structure while simultaneously incorporating the pairwise constraints to construct a similarity matrix needed for clustering.",
      "evidence_field": "abstract",
      "reason_zh": "论文学习子空间结构并用于聚类，属于按潜在子空间分组的子空间聚类任务。"
    },
    {
      "keyword_id": "sparse-representation",
      "exact_quote": "Building upon the successes of sparse subspace clustering (SSC) in uncovering the underlying structure of the data",
      "evidence_field": "abstract",
      "reason_zh": "方法基于稀疏子空间聚类，以稀疏自表达表示学习样本潜在结构，符合稀疏表示方法。"
    },
    {
      "keyword_id": "pairwise-constraint-propagation",
      "exact_quote": "Our joint formulation uses low-rank matrix completion to propagate the initial pairwise constraints",
      "evidence_field": "abstract",
      "reason_zh": "使用低秩矩阵补全传播初始的must-link/cannot-link成对约束，满足成对约束传播定义。"
    },
    {
      "keyword_id": "low-rank-modeling",
      "exact_quote": "Our joint formulation uses low-rank matrix completion to propagate the initial pairwise constraints",
      "evidence_field": "abstract",
      "reason_zh": "联合公式显式使用低秩矩阵补全，属于利用低秩约束/分解建模相关结构。"
    },
    {
      "keyword_id": "semi-supervised-learning",
      "exact_quote": "where pairwise sample constraints (must-link and cannot-link sample pairs) are available in the processing pipeline",
      "evidence_field": "abstract",
      "reason_zh": "利用有限成对约束与未标注样本进行聚类，符合以有限成对约束指导全部样本学习的半监督设定。"
    },
    {
      "keyword_id": "graph-structure-learning",
      "exact_quote": "We learn the subspace structure while simultaneously incorporating the pairwise constraints to construct a similarity matrix needed for clustering.",
      "evidence_field": "abstract",
      "reason_zh": "联合学习子空间结构并结合成对约束构造聚类相似度矩阵，明确学习样本亲和关系，已有证据足以支持图结构学习。"
    },
    {
      "keyword_id": "weakly-supervised-learning",
      "exact_quote": "pairwise sample constraints (must-link and cannot-link sample pairs) are available in the processing pipeline since detected faces can be tracked locally in time",
      "evidence_field": "abstract",
      "reason_zh": "以局部时间跟踪获得的成对关系指导人脸聚类而非完整实例身份真值，且传播初始约束以补充监督，属于不完整监督的实质设定；半监督与弱监督没有声明父子关系。"
    }
  ],
  "abstentions": [],
  "input_issues": []
}
