{
  "paper_id": "lab-3f9060fdcde7",
  "annotations": [
    {
      "keyword_id": "deep-clustering",
      "exact_quote": "We integrate the proposed method into a contrastive learning framework to achieve clustering, where representation learning and clustering are simultaneously conducted.",
      "evidence_field": "abstract",
      "reason_zh": "论文将所提图卷积方法融入对比学习框架，同时进行表示学习与聚类，属于利用可学习神经表示获得数据划分的深度聚类。"
    },
    {
      "keyword_id": "graph-neural-networks",
      "exact_quote": "we first propose a structural-spectral graph convolutional operator (SSGCO) tailored for graph-structured HSI superpixels to improve their representation quality through the co-extraction of spatial and spectral features.",
      "evidence_field": "abstract",
      "reason_zh": "论文提出结构-光谱图卷积算子用于图结构高光谱超像素的表示学习，属于图上的可学习图卷积/消息传递。"
    },
    {
      "keyword_id": "graph-structure-learning",
      "exact_quote": "we propose an evidence-guided adaptive edge learning (EGAEL) module that adaptively predicts and refines edge weights in the superpixel topological graph.",
      "evidence_field": "abstract",
      "reason_zh": "论文提出自适应边学习模块，预测并修正超像素拓扑图中的边权重，即学习或修正样本间邻接关系。"
    },
    {
      "keyword_id": "contrastive-learning",
      "exact_quote": "We integrate the proposed method into a contrastive learning framework to achieve clustering",
      "evidence_field": "abstract",
      "reason_zh": "论文明确将方法整合进对比学习框架以实现聚类，通过吸引与区分目标学习表示。"
    },
    {
      "keyword_id": "hyperspectral-images",
      "exact_quote": "Hyperspectral Image Clustering",
      "evidence_field": "title",
      "reason_zh": "论文研究对象为高光谱图像聚类，处理具有密集光谱波段的图像。"
    },
    {
      "keyword_id": "multi-view-learning",
      "exact_quote": "through the co-extraction of spatial and spectral features",
      "evidence_field": "abstract",
      "reason_zh": "论文显式联合提取空间与光谱特征，二者是同一高光谱对象互补的特征视图，满足多视图联合利用设定。"
    }
  ],
  "abstentions": [],
  "input_issues": []
}
