{
  "paper_id": "lab-4f00a8eb8a7d",
  "annotations": [
    {
      "keyword_id": "image-segmentation",
      "exact_quote": "including semantic segmentation, instance segmentation, and object detection",
      "evidence_field": "abstract",
      "reason_zh": "摘要明确在多种水下密集预测任务上评估，包括语义分割与实例分割，属于像素级区域或类别划分任务。"
    },
    {
      "keyword_id": "underwater-images",
      "exact_quote": "quality degradation, and light scattering in underwater images",
      "evidence_field": "abstract",
      "reason_zh": "摘要以水下图像的光散射、质量退化及水下密集预测为研究对象，属于直接处理水下采集图像。"
    }
  ],
  "abstentions": [
    {
      "keyword_id": "parameter-efficient-fine-tuning",
      "reason_zh": "仅有模型名和 adapted ViT backbone 线索，未说明冻结预训练主干或仅训练少量增量参数/选定参数，无法确认参数高效微调。"
    },
    {
      "keyword_id": "domain-adaptation",
      "reason_zh": "仅称适配到水下密集预测并使用 ImageNet 预训练，未明确源域与目标域分布差异及迁移适配过程，证据不足。"
    }
  ],
  "input_issues": []
}
