{
  "paper_id": "W2578312891",
  "annotations": [
    {
      "keyword_id": "bayesian-inference",
      "exact_quote": "novel parametric Bayesian model",
      "evidence_field": "abstract",
      "reason_zh": "摘要提出用于半监督分类与聚类的新型参数化贝叶斯模型，通过先验与概率模型进行后验推断，满足贝叶斯推断定义。"
    },
    {
      "keyword_id": "low-rank-modeling",
      "exact_quote": "Mixture of Factor Analysers",
      "evidence_field": "title",
      "reason_zh": "标题表明模型采用因子分析器混合；因子分析以低维因子载荷对协方差做低秩分解或近似，属于显式低秩建模。"
    },
    {
      "keyword_id": "semi-supervised-learning",
      "exact_quote": "problem of semi-supervised classification and clustering",
      "evidence_field": "abstract",
      "reason_zh": "论文明确以半监督分类与聚类为研究问题，结合有限监督与未标注样本，满足半监督学习设定。"
    },
    {
      "keyword_id": "weakly-supervised-learning",
      "exact_quote": "semi-supervised classification and clustering",
      "evidence_field": "abstract",
      "reason_zh": "半监督设定以有限标注替代完整实例级真值，属于不完整监督，且该监督条件构成论文核心研究问题。"
    }
  ],
  "abstentions": [
    {
      "keyword_id": "subspace-clustering",
      "reason_zh": "标题中的Mixture of Factor Analysers可能涉及潜在子空间建模，但摘要未说明按样本所属潜在子空间分组或使用自表达关系，定义证据不足。"
    }
  ],
  "input_issues": []
}
