{
  "paper_id": "W2291338622",
  "annotations": [
    {
      "keyword_id": "multi-view-learning",
      "exact_quote": "Multi-view graph clustering aims to enhance clustering performance by integrating heterogeneous information collected in different domains.",
      "evidence_field": "abstract",
      "reason_zh": "论文任务为多视图图聚类，显式联合不同域/视图的异构信息。"
    },
    {
      "keyword_id": "nonnegative-matrix-factorization",
      "exact_quote": "based on non-negative matrix factorization (NMF)",
      "evidence_field": "abstract",
      "reason_zh": "提出的CGC框架明确基于非负矩阵分解。"
    },
    {
      "keyword_id": "weakly-supervised-learning",
      "exact_quote": "Third, it allows partial cross-domain mapping so that graphs in different domains may have different sizes.",
      "evidence_field": "abstract",
      "reason_zh": "允许部分跨域映射，即以不完整的跨域对应关系作为弱监督条件，并处理噪声域。"
    },
    {
      "keyword_id": "graph-manifold-regularization",
      "exact_quote": "we propose a flexible and robust framework, Co-regularized Graph Clustering (CGC), based on non-negative matrix factorization (NMF), to tackle these challenges.",
      "evidence_field": "abstract",
      "reason_zh": "方法名为Co-regularized Graph Clustering，采用跨域图协同正则化施加一致性约束。"
    }
  ],
  "abstentions": [
    {
      "keyword_id": "graph-structure-learning",
      "reason_zh": "只提到跨域关系加权与部分映射，未明确学习或修正样本间边、邻接或亲和矩阵。"
    }
  ],
  "input_issues": []
}
