{
  "paper_id": "W2482276862",
  "annotations": [
    {
      "keyword_id": "nonnegative-matrix-factorization",
      "exact_quote": "Properties of Nonnegative Matrix Factorization (NMF) as a clustering method are studied",
      "evidence_field": "abstract",
      "reason_zh": "论文以非负矩阵分解（NMF）为核心方法研究其聚类性质，标题和摘要均明确使用NMF。"
    },
    {
      "keyword_id": "low-rank-modeling",
      "exact_quote": "lower rank approximation with special constraints",
      "evidence_field": "abstract",
      "reason_zh": "摘要将K-means目标解释为带有特殊约束的低秩近似，并在此基础上比较NMF约束，显式涉及低秩近似表示。"
    },
    {
      "keyword_id": "sparse-representation",
      "exact_quote": "By introducing sparsity constraints on the coefficient",
      "evidence_field": "abstract",
      "reason_zh": "通过在NMF目标函数的系数矩阵因子上引入稀疏约束，使样本由稀疏基向量组合表示，满足稀疏表示定义。"
    }
  ],
  "abstentions": [],
  "input_issues": []
}
