{
  "paper_id": "W4353093926",
  "annotations": [
    {
      "keyword_id": "nonnegative-matrix-factorization",
      "exact_quote": "non-negative matrix factorization",
      "evidence_field": "title",
      "reason_zh": "标题直接提出以非负矩阵分解为核心方法，符合非负因子分解矩阵的定义。"
    },
    {
      "keyword_id": "multi-view-learning",
      "exact_quote": "multi-view",
      "evidence_field": "title",
      "reason_zh": "标题明确面向多视图数据并联合视图进行矩阵分解，符合多视图学习设定。"
    },
    {
      "keyword_id": "graph-structure-learning",
      "exact_quote": "adaptive graph",
      "evidence_field": "title",
      "reason_zh": "adaptive graph 表明样本图/亲和结构由模型自适应学习或修正，而非固定图。"
    },
    {
      "keyword_id": "graph-manifold-regularization",
      "exact_quote": "adaptive graph and diversity constraints",
      "evidence_field": "title",
      "reason_zh": "标题把 adaptive graph 作为约束项，说明用图结构对分解学习施加一致性约束，符合图与流形正则化。"
    }
  ],
  "abstentions": [
    {
      "keyword_id": "adversarial-robustness",
      "reason_zh": "标题有 Robust，但未说明对抗攻击或扰动，无法判断是否研究对抗鲁棒性。"
    },
    {
      "keyword_id": "low-rank-modeling",
      "reason_zh": "虽含矩阵分解，但标题未显式给出低秩约束/近似，且非负约束不自动支持低秩。"
    },
    {
      "keyword_id": "dimensionality-reduction",
      "reason_zh": "NMF 可能隐含降维，但标题未表明以显式低维映射或维度压缩为目标。"
    }
  ],
  "input_issues": []
}
